1540889849.325075 IP 192.168.168.100.61206 > 72.247.178.18.80: Flags [SEW], seq 1646017262, win 65535, options [mss 1460,nop,wscale 6,nop,nop,TS val 3114244558 ecr 0,sackOK,eol], length 0
1540889849.325117 IP 192.168.168.100.61207 > 72.247.178.18.80: Flags [SEW], seq 2035117383, win 65535, options [mss 1460,nop,wscale 6,nop,nop,TS val 3114244558 ecr 0,sackOK,eol], length 0
1540889849.325145 IP 192.168.168.100.61208 > 72.247.178.18.80: Flags [SEW], seq 1069231822, win 65535, options [mss 1460,nop,wscale 6,nop,nop,TS val 3114244558 ecr 0,sackOK,eol], length 0
1540889849.325226 IP 192.168.168.100.61209 > 72.247.178.18.80: Flags [SEW], seq 3747613547, win 65535, options [mss 1460,nop,wscale 6,nop,nop,TS val 3114244558 ecr 0,sackOK,eol], length 0
1540889849.336883 IP 72.247.178.18.80 > 192.168.168.100.61206: Flags [S.], seq 1647221655, ack 1646017263, win 28960, options [mss 1460,sackOK,TS val 1643373851 ecr 3114244558,nop,wscale 7], length 0
1540889849.336914 IP 192.168.168.100.61206 > 72.247.178.18.80: Flags [.], ack 1, win 2058, options [nop,nop,TS val 3114244568 ecr 1643373851], length 0
1540889849.337392 IP 192.168.168.100.61206 > 72.247.178.18.80: Flags [P.], seq 1:446, ack 1, win 2058, options [nop,nop,TS val 3114244568 ecr 1643373851], length 445: HTTP: POST / HTTP/1.1
1540889849.337925 IP 72.247.178.18.80 > 192.168.168.100.61207: Flags [S.], seq 624786838, ack 2035117384, win 28960, options [mss 1460,sackOK,TS val 1643373852 ecr 3114244558,nop,wscale 7], length 0
1540889849.337951 IP 192.168.168.100.61207 > 72.247.178.18.80: Flags [.], ack 1, win 2058, options [nop,nop,TS val 3114244569 ecr 1643373852], length 0
1540889849.338357 IP 192.168.168.100.61207 > 72.247.178.18.80: Flags [P.], seq 1:446, ack 1, win 2058, options [nop,nop,TS val 3114244569 ecr 1643373852], length 445: HTTP: POST / HTTP/1.1
1540889849.339110 IP 72.247.178.18.80 > 192.168.168.100.61208: Flags [S.], seq 4040006663, ack 1069231823, win 28960, options [mss 1460,sackOK,TS val 1643373853 ecr 3114244558,nop,wscale 7], length 0
1540889849.339123 IP 192.168.168.100.61208 > 72.247.178.18.80: Flags [.], ack 1, win 2058, options [nop,nop,TS val 3114244570 ecr 1643373853], length 0
1540889849.339531 IP 192.168.168.100.61208 > 72.247.178.18.80: Flags [P.], seq 1:446, ack 1, win 2058, options [nop,nop,TS val 3114244570 ecr 1643373853], length 445: HTTP: POST / HTTP/1.1
1540889849.340286 IP 72.247.178.18.80 > 192.168.168.100.61209: Flags [S.], seq 4175083159, ack 3747613548, win 28960, options [mss 1460,sackOK,TS val 1643373854 ecr 3114244558,nop,wscale 7], length 0
1540889849.340300 IP 192.168.168.100.61209 > 72.247.178.18.80: Flags [.], ack 1, win 2058, options [nop,nop,TS val 3114244571 ecr 1643373854], length 0
1540889849.340621 IP 192.168.168.100.61209 > 72.247.178.18.80: Flags [P.], seq 1:446, ack 1, win 2058, options [nop,nop,TS val 3114244571 ecr 1643373854], length 445: HTTP: POST / HTTP/1.1
1540889849.346318 IP 192.168.168.100.61210 > 72.247.178.18.80: Flags [SEW], seq 520245883, win 65535, options [mss 1460,nop,wscale 6,nop,nop,TS val 3114244575 ecr 0,sackOK,eol], length 0
1540889849.349422 IP 72.247.178.18.80 > 192.168.168.100.61206: Flags [.], ack 446, win 235, options [nop,nop,TS val 1643373862 ecr 3114244568], length 0
1540889849.349424 IP 72.247.178.18.80 > 192.168.168.100.61206: Flags [P.], seq 1:869, ack 446, win 235, options [nop,nop,TS val 1643373863 ecr 3114244568], length 868: HTTP: HTTP/1.1 200 OK
1540889849.349425 IP 72.247.178.18.80 > 192.168.168.100.61207: Flags [.], ack 446, win 235, options [nop,nop,TS val 1643373863 ecr 3114244569], length 0
1540889849.349438 IP 192.168.168.100.61206 > 72.247.178.18.80: Flags [.], ack 869, win 2045, options [nop,nop,TS val 3114244577 ecr 1643373863], length 0
1540889849.349665 IP 72.247.178.18.80 > 192.168.168.100.61207: Flags [P.], seq 1:869, ack 446, win 235, options [nop,nop,TS val 1643373864 ecr 3114244569], length 868: HTTP: HTTP/1.1 200 OK
1540889849.349676 IP 192.168.168.100.61207 > 72.247.178.18.80: Flags [.], ack 869, win 2045, options [nop,nop,TS val 3114244578 ecr 1643373864], length 0
1540889849.349842 IP 192.168.168.100.61206 > 72.247.178.18.80: Flags [P.], seq 446:891, ack 869, win 2048, options [nop,nop,TS val 3114244578 ecr 1643373863], length 445: HTTP: POST / HTTP/1.1
1540889849.350026 IP 72.247.178.18.80 > 192.168.168.100.61208: Flags [.], ack 446, win 235, options [nop,nop,TS val 1643373864 ecr 3114244570], length 0
1540889849.350669 IP 72.247.178.18.80 > 192.168.168.100.61208: Flags [P.], seq 1:869, ack 446, win 235, options [nop,nop,TS val 1643373865 ecr 3114244570], length 868: HTTP: HTTP/1.1 200 OK
1540889849.350697 IP 192.168.168.100.61208 > 72.247.178.18.80: Flags [.], ack 869, win 2045, options [nop,nop,TS val 3114244579 ecr 1643373865], length 0
1540889849.351250 IP 72.247.178.18.80 > 192.168.168.100.61209: Flags [.], ack 446, win 235, options [nop,nop,TS val 1643373866 ecr 3114244571], length 0
1540889849.351713 IP 72.247.178.18.80 > 192.168.168.100.61209: Flags [P.], seq 1:869, ack 446, win 235, options [nop,nop,TS val 1643373866 ecr 3114244571], length 868: HTTP: HTTP/1.1 200 OK
1540889849.351736 IP 192.168.168.100.61209 > 72.247.178.18.80: Flags [.], ack 869, win 2045, options [nop,nop,TS val 3114244580 ecr 1643373866], length 0
1540889849.358079 IP 72.247.178.18.80 > 192.168.168.100.61210: Flags [S.], seq 2390365903, ack 520245884, win 28960, options [mss 1460,sackOK,TS val 1643373872 ecr 3114244575,nop,wscale 7], length 0
1540889849.358148 IP 192.168.168.100.61210 > 72.247.178.18.80: Flags [.], ack 1, win 2058, options [nop,nop,TS val 3114244585 ecr 1643373872], length 0
1540889849.360965 IP 72.247.178.18.80 > 192.168.168.100.61206: Flags [P.], seq 869:1737, ack 891, win 243, options [nop,nop,TS val 1643373875 ecr 3114244578], length 868: HTTP: HTTP/1.1 200 OK
1540889849.360989 IP 192.168.168.100.61206 > 72.247.178.18.80: Flags [.], ack 1737, win 2034, options [nop,nop,TS val 3114244587 ecr 1643373875], length 0
1540889854.369595 IP 192.168.168.100.61210 > 72.247.178.18.80: Flags [F.], seq 1, ack 1, win 2058, options [nop,nop,TS val 3114249547 ecr 1643373872], length 0
1540889854.380279 IP 72.247.178.18.80 > 192.168.168.100.61210: Flags [.], ack 2, win 227, options [nop,nop,TS val 1643378895 ecr 3114249547], length 0
1540889854.380343 IP 72.247.178.18.80 > 192.168.168.100.61210: Flags [F.], seq 1, ack 2, win 227, options [nop,nop,TS val 1643378895 ecr 3114249547], length 0
1540889854.380403 IP 192.168.168.100.61210 > 72.247.178.18.80: Flags [.], ack 2, win 2058, options [nop,nop,TS val 3114249557 ecr 1643378895], length 0
1540889859.466886 IP 192.168.168.100.61207 > 72.247.178.18.80: Flags [.], ack 869, win 2048, length 0
1540889859.466886 IP 192.168.168.100.61208 > 72.247.178.18.80: Flags [.], ack 869, win 2048, length 0
1540889859.466886 IP 192.168.168.100.61209 > 72.247.178.18.80: Flags [.], ack 869, win 2048, length 0
1540889859.466935 IP 192.168.168.100.61206 > 72.247.178.18.80: Flags [.], ack 1737, win 2048, length 0
1540889859.477393 IP 72.247.178.18.80 > 192.168.168.100.61209: Flags [.], ack 446, win 235, options [nop,nop,TS val 1643383992 ecr 3114244580], length 0
1540889859.477496 IP 72.247.178.18.80 > 192.168.168.100.61208: Flags [.], ack 446, win 235, options [nop,nop,TS val 1643383992 ecr 3114244579], length 0
1540889859.477497 IP 72.247.178.18.80 > 192.168.168.100.61207: Flags [.], ack 446, win 235, options [nop,nop,TS val 1643383992 ecr 3114244578], length 0
1540889859.477498 IP 72.247.178.18.80 > 192.168.168.100.61206: Flags [.], ack 891, win 243, options [nop,nop,TS val 1643383992 ecr 3114244587], length 0
1540889869.587994 IP 192.168.168.100.61209 > 72.247.178.18.80: Flags [.], ack 869, win 2048, length 0
1540889869.587995 IP 192.168.168.100.61208 > 72.247.178.18.80: Flags [.], ack 869, win 2048, length 0
1540889869.588004 IP 192.168.168.100.61207 > 72.247.178.18.80: Flags [.], ack 869, win 2048, length 0
1540889869.588009 IP 192.168.168.100.61206 > 72.247.178.18.80: Flags [.], ack 1737, win 2048, length 0
1540889869.598535 IP 72.247.178.18.80 > 192.168.168.100.61209: Flags [.], ack 446, win 235, options [nop,nop,TS val 1643394113 ecr 3114244580], length 0
1540889869.598591 IP 72.247.178.18.80 > 192.168.168.100.61207: Flags [.], ack 446, win 235, options [nop,nop,TS val 1643394113 ecr 3114244578], length 0
1540889869.598595 IP 72.247.178.18.80 > 192.168.168.100.61208: Flags [.], ack 446, win 235, options [nop,nop,TS val 1643394113 ecr 3114244579], length 0
1540889869.598598 IP 72.247.178.18.80 > 192.168.168.100.61206: Flags [.], ack 891, win 243, options [nop,nop,TS val 1643394113 ecr 3114244587], length 0
1540889879.642949 IP 192.168.168.100.61209 > 72.247.178.18.80: Flags [.], ack 869, win 2048, length 0
1540889879.642951 IP 192.168.168.100.61208 > 72.247.178.18.80: Flags [.], ack 869, win 2048, length 0
1540889879.642962 IP 192.168.168.100.61207 > 72.247.178.18.80: Flags [.], ack 869, win 2048, length 0
1540889879.642963 IP 192.168.168.100.61206 > 72.247.178.18.80: Flags [.], ack 1737, win 2048, length 0
1540889879.653522 IP 72.247.178.18.80 > 192.168.168.100.61209: Flags [.], ack 446, win 235, options [nop,nop,TS val 1643404168 ecr 3114244580], length 0
1540889879.653562 IP 72.247.178.18.80 > 192.168.168.100.61207: Flags [.], ack 446, win 235, options [nop,nop,TS val 1643404168 ecr 3114244578], length 0
1540889879.653566 IP 72.247.178.18.80 > 192.168.168.100.61208: Flags [.], ack 446, win 235, options [nop,nop,TS val 1643404168 ecr 3114244579], length 0
1540889879.653568 IP 72.247.178.18.80 > 192.168.168.100.61206: Flags [.], ack 891, win 243, options [nop,nop,TS val 1643404168 ecr 3114244587], length 0
1540889889.737972 IP 192.168.168.100.61209 > 72.247.178.18.80: Flags [.], ack 869, win 2048, length 0
1540889889.737973 IP 192.168.168.100.61206 > 72.247.178.18.80: Flags [.], ack 1737, win 2048, length 0
1540889889.737973 IP 192.168.168.100.61207 > 72.247.178.18.80: Flags [.], ack 869, win 2048, length 0
1540889889.737973 IP 192.168.168.100.61208 > 72.247.178.18.80: Flags [.], ack 869, win 2048, length 0
1540889889.748494 IP 72.247.178.18.80 > 192.168.168.100.61209: Flags [.], ack 446, win 235, options [nop,nop,TS val 1643414263 ecr 3114244580], length 0
1540889889.748495 IP 72.247.178.18.80 > 192.168.168.100.61208: Flags [.], ack 446, win 235, options [nop,nop,TS val 1643414263 ecr 3114244579], length 0
1540889889.748496 IP 72.247.178.18.80 > 192.168.168.100.61207: Flags [.], ack 446, win 235, options [nop,nop,TS val 1643414263 ecr 3114244578], length 0
1540889889.748497 IP 72.247.178.18.80 > 192.168.168.100.61206: Flags [.], ack 891, win 243, options [nop,nop,TS val 1643414263 ecr 3114244587], length 0
1540889899.876912 IP 192.168.168.100.61209 > 72.247.178.18.80: Flags [.], ack 869, win 2048, length 0
1540889899.876914 IP 192.168.168.100.61208 > 72.247.178.18.80: Flags [.], ack 869, win 2048, length 0
1540889899.876915 IP 192.168.168.100.61206 > 72.247.178.18.80: Flags [.], ack 1737, win 2048, length 0
1540889899.876915 IP 192.168.168.100.61207 > 72.247.178.18.80: Flags [.], ack 869, win 2048, length 0
1540889899.887528 IP 72.247.178.18.80 > 192.168.168.100.61207: Flags [.], ack 446, win 235, options [nop,nop,TS val 1643424402 ecr 3114244578], length 0
1540889899.887539 IP 72.247.178.18.80 > 192.168.168.100.61209: Flags [.], ack 446, win 235, options [nop,nop,TS val 1643424402 ecr 3114244580], length 0
1540889899.887543 IP 72.247.178.18.80 > 192.168.168.100.61208: Flags [.], ack 446, win 235, options [nop,nop,TS val 1643424402 ecr 3114244579], length 0
1540889899.887546 IP 72.247.178.18.80 > 192.168.168.100.61206: Flags [.], ack 891, win 243, options [nop,nop,TS val 1643424402 ecr 3114244587], length 0
1540889910.001864 IP 192.168.168.100.61209 > 72.247.178.18.80: Flags [.], ack 869, win 2048, length 0
1540889910.001866 IP 192.168.168.100.61208 > 72.247.178.18.80: Flags [.], ack 869, win 2048, length 0
1540889910.001881 IP 192.168.168.100.61206 > 72.247.178.18.80: Flags [.], ack 1737, win 2048, length 0
1540889910.001881 IP 192.168.168.100.61207 > 72.247.178.18.80: Flags [.], ack 869, win 2048, length 0
1540889910.012344 IP 72.247.178.18.80 > 192.168.168.100.61209: Flags [.], ack 446, win 235, options [nop,nop,TS val 1643434527 ecr 3114244580], length 0
1540889910.012384 IP 72.247.178.18.80 > 192.168.168.100.61208: Flags [.], ack 446, win 235, options [nop,nop,TS val 1643434527 ecr 3114244579], length 0
1540889910.012438 IP 72.247.178.18.80 > 192.168.168.100.61206: Flags [.], ack 891, win 243, options [nop,nop,TS val 1643434527 ecr 3114244587], length 0
1540889910.012566 IP 72.247.178.18.80 > 192.168.168.100.61207: Flags [.], ack 446, win 235, options [nop,nop,TS val 1643434527 ecr 3114244578], length 0
1540889920.126814 IP 192.168.168.100.61209 > 72.247.178.18.80: Flags [.], ack 869, win 2048, length 0
1540889920.126816 IP 192.168.168.100.61208 > 72.247.178.18.80: Flags [.], ack 869, win 2048, length 0
1540889920.126817 IP 192.168.168.100.61206 > 72.247.178.18.80: Flags [.], ack 1737, win 2048, length 0
1540889920.126817 IP 192.168.168.100.61207 > 72.247.178.18.80: Flags [.], ack 869, win 2048, length 0
1540889920.137329 IP 72.247.178.18.80 > 192.168.168.100.61209: Flags [.], ack 446, win 235, options [nop,nop,TS val 1643444652 ecr 3114244580], length 0
1540889920.137334 IP 72.247.178.18.80 > 192.168.168.100.61208: Flags [.], ack 446, win 235, options [nop,nop,TS val 1643444652 ecr 3114244579], length 0
1540889920.137337 IP 72.247.178.18.80 > 192.168.168.100.61207: Flags [.], ack 446, win 235, options [nop,nop,TS val 1643444652 ecr 3114244578], length 0
1540889920.137367 IP 72.247.178.18.80 > 192.168.168.100.61206: Flags [.], ack 891, win 243, options [nop,nop,TS val 1643444652 ecr 3114244587], length 0
1540889930.224776 IP 192.168.168.100.61209 > 72.247.178.18.80: Flags [.], ack 869, win 2048, length 0
1540889930.224777 IP 192.168.168.100.61208 > 72.247.178.18.80: Flags [.], ack 869, win 2048, length 0
1540889930.224778 IP 192.168.168.100.61207 > 72.247.178.18.80: Flags [.], ack 869, win 2048, length 0
1540889930.224779 IP 192.168.168.100.61206 > 72.247.178.18.80: Flags [.], ack 1737, win 2048, length 0
1540889930.235412 IP 72.247.178.18.80 > 192.168.168.100.61207: Flags [.], ack 446, win 235, options [nop,nop,TS val 1643454750 ecr 3114244578], length 0
1540889930.235414 IP 72.247.178.18.80 > 192.168.168.100.61209: Flags [.], ack 446, win 235, options [nop,nop,TS val 1643454750 ecr 3114244580], length 0
1540889930.235415 IP 72.247.178.18.80 > 192.168.168.100.61208: Flags [.], ack 446, win 235, options [nop,nop,TS val 1643454750 ecr 3114244579], length 0
1540889930.235416 IP 72.247.178.18.80 > 192.168.168.100.61206: Flags [.], ack 891, win 243, options [nop,nop,TS val 1643454750 ecr 3114244587], length 0
1540889940.304694 IP 192.168.168.100.61209 > 72.247.178.18.80: Flags [.], ack 869, win 2048, length 0
1540889940.304695 IP 192.168.168.100.61208 > 72.247.178.18.80: Flags [.], ack 869, win 2048, length 0
1540889940.304706 IP 192.168.168.100.61206 > 72.247.178.18.80: Flags [.], ack 1737, win 2048, length 0
1540889940.304706 IP 192.168.168.100.61207 > 72.247.178.18.80: Flags [.], ack 869, win 2048, length 0
1540889940.315298 IP 72.247.178.18.80 > 192.168.168.100.61209: Flags [.], ack 446, win 235, options [nop,nop,TS val 1643464830 ecr 3114244580], length 0
1540889940.315310 IP 72.247.178.18.80 > 192.168.168.100.61208: Flags [.], ack 446, win 235, options [nop,nop,TS val 1643464830 ecr 3114244579], length 0
1540889940.315313 IP 72.247.178.18.80 > 192.168.168.100.61207: Flags [.], ack 446, win 235, options [nop,nop,TS val 1643464830 ecr 3114244578], length 0
1540889940.315316 IP 72.247.178.18.80 > 192.168.168.100.61206: Flags [.], ack 891, win 243, options [nop,nop,TS val 1643464830 ecr 3114244587], length 0
1540889950.375701 IP 192.168.168.100.61207 > 72.247.178.18.80: Flags [.], ack 869, win 2048, length 0
1540889950.375701 IP 192.168.168.100.61208 > 72.247.178.18.80: Flags [.], ack 869, win 2048, length 0
1540889950.375701 IP 192.168.168.100.61209 > 72.247.178.18.80: Flags [.], ack 869, win 2048, length 0
1540889950.375702 IP 192.168.168.100.61206 > 72.247.178.18.80: Flags [.], ack 1737, win 2048, length 0
1540889950.386266 IP 72.247.178.18.80 > 192.168.168.100.61209: Flags [.], ack 446, win 235, options [nop,nop,TS val 1643474901 ecr 3114244580], length 0
1540889950.386291 IP 72.247.178.18.80 > 192.168.168.100.61208: Flags [.], ack 446, win 235, options [nop,nop,TS val 1643474901 ecr 3114244579], length 0
1540889950.386295 IP 72.247.178.18.80 > 192.168.168.100.61206: Flags [.], ack 891, win 243, options [nop,nop,TS val 1643474901 ecr 3114244587], length 0
1540889950.386298 IP 72.247.178.18.80 > 192.168.168.100.61207: Flags [.], ack 446, win 235, options [nop,nop,TS val 1643474901 ecr 3114244578], length 0
1540889960.734638 IP 192.168.168.100.61208 > 72.247.178.18.80: Flags [.], ack 869, win 2048, length 0
1540889960.734638 IP 192.168.168.100.61209 > 72.247.178.18.80: Flags [.], ack 869, win 2048, length 0
1540889960.734639 IP 192.168.168.100.61206 > 72.247.178.18.80: Flags [.], ack 1737, win 2048, length 0
1540889960.734639 IP 192.168.168.100.61207 > 72.247.178.18.80: Flags [.], ack 869, win 2048, length 0
1540889960.745300 IP 72.247.178.18.80 > 192.168.168.100.61207: Flags [.], ack 446, win 235, options [nop,nop,TS val 1643485260 ecr 3114244578], length 0
1540889960.745301 IP 72.247.178.18.80 > 192.168.168.100.61209: Flags [.], ack 446, win 235, options [nop,nop,TS val 1643485260 ecr 3114244580], length 0
1540889960.745302 IP 72.247.178.18.80 > 192.168.168.100.61208: Flags [.], ack 446, win 235, options [nop,nop,TS val 1643485260 ecr 3114244579], length 0
1540889960.745303 IP 72.247.178.18.80 > 192.168.168.100.61206: Flags [.], ack 891, win 243, options [nop,nop,TS val 1643485260 ecr 3114244587], length 0
1540889965.035284 IP 192.168.168.100.61206 > 72.247.178.18.80: Flags [F.], seq 891, ack 1737, win 2048, options [nop,nop,TS val 3114359565 ecr 1643485260], length 0
1540889965.035284 IP 192.168.168.100.61207 > 72.247.178.18.80: Flags [F.], seq 446, ack 869, win 2048, options [nop,nop,TS val 3114359565 ecr 1643485260], length 0
1540889965.035284 IP 192.168.168.100.61208 > 72.247.178.18.80: Flags [F.], seq 446, ack 869, win 2048, options [nop,nop,TS val 3114359565 ecr 1643485260], length 0
1540889965.035284 IP 192.168.168.100.61209 > 72.247.178.18.80: Flags [F.], seq 446, ack 869, win 2048, options [nop,nop,TS val 3114359565 ecr 1643485260], length 0
1540889965.046032 IP 72.247.178.18.80 > 192.168.168.100.61209: Flags [F.], seq 869, ack 447, win 235, options [nop,nop,TS val 1643489560 ecr 3114359565], length 0
1540889965.046153 IP 72.247.178.18.80 > 192.168.168.100.61208: Flags [F.], seq 869, ack 447, win 235, options [nop,nop,TS val 1643489560 ecr 3114359565], length 0
1540889965.046154 IP 72.247.178.18.80 > 192.168.168.100.61206: Flags [F.], seq 1737, ack 892, win 243, options [nop,nop,TS val 1643489560 ecr 3114359565], length 0
1540889965.046181 IP 192.168.168.100.61209 > 72.247.178.18.80: Flags [.], ack 870, win 2048, options [nop,nop,TS val 3114359575 ecr 1643489560], length 0
1540889965.046193 IP 72.247.178.18.80 > 192.168.168.100.61207: Flags [F.], seq 869, ack 447, win 235, options [nop,nop,TS val 1643489560 ecr 3114359565], length 0
1540889965.046205 IP 192.168.168.100.61208 > 72.247.178.18.80: Flags [.], ack 870, win 2048, options [nop,nop,TS val 3114359575 ecr 1643489560], length 0
1540889965.046209 IP 192.168.168.100.61206 > 72.247.178.18.80: Flags [.], ack 1738, win 2048, options [nop,nop,TS val 3114359575 ecr 1643489560], length 0
1540889965.046217 IP 192.168.168.100.61207 > 72.247.178.18.80: Flags [.], ack 870, win 2048, options [nop,nop,TS val 3114359575 ecr 1643489560], length 0
